,Liptruzet,FALSE,FALSE,TRUE,FALSE,FALSE,FALSE,FALSE,FALSE,FALSE,FALSE,FALSE,FALSE,FALSE,FALSE,Liptruzet (atorvastatin and ezetimibe) is a statin (HMG-CoA reductase inhibitor) and cholesterol absorption inhibitor combination indicated for the treatment of hyperlipidemia.,Merck,Heterozygous Familial Hypercholesterolemia,3-May-13,5/3/13,Liptruzet,atorvastatin and ezetimibe,atorvastatin,,,,,,,,,,
,Procysbi,NA,NA,NA,NA,NA,NA,NA,NA,NA,NA,NA,NA,NA,NA,Procysbi (cysteamine bitartrate) is a cystine depleting agent indicated for the treatment of nephropathic cystinosis.,Raptor Pharmaceutical Corp.,Nephropathic Cystinosis,30-Apr-13,4/30/13,Procysbi,cysteamine bitartrate,cysteamine,,,,,,,,,,
,Kcentra,NA,NA,NA,NA,NA,NA,NA,NA,NA,NA,NA,NA,NA,NA,,CSL Behring,Reversal of Vitamin K Antagonist (VKA) Anticoagulation,29-Apr-13,4/29/13,Kcentra,NA,NA,,,,,,,,,,
,Simbrinza,NA,NA,NA,TRUE,NA,NA,NA,NA,NA,NA,NA,NA,TRUE,NA,Simbrinza (brimonidine and brinzolamide) is a fixed combination of an alpha 2 adrenergic receptor agonist and a carbonic anhydrase inhibitor indicated for the reduction of elevated intraocular pressure in patients with open-angle glaucoma or ocular hypertension.,Alcon,Glaucoma,19-Apr-13,4/19/13,Simbrinza,brimonidine and brinzolamide,brimonidine,,,,,,,,,,
,Sitavig,NA,NA,NA,NA,NA,NA,NA,NA,NA,NA,NA,NA,NA,NA,Sitavig (acyclovir) is a mucoadhesive buccal tablet formulation of the antiviral drug acyclovir indicated for the treatment of recurrent orofacial herpes (cold sores).,BioAlliance Pharma SA,Herpes Simplex Labialis,12-Apr-13,4/12/13,Sitavig,acyclovir,acyclovir,,,,,,,,,,
,Diclegis,NA,NA,NA,NA,NA,NA,NA,NA,NA,NA,NA,TRUE,NA,NA,"Diclegis (doxylamine and pyridoxine) is an antihistamine and vitamin B6 analog combination indicated for the treatment of nausea and vomiting of pregnancy in womenwho do not respond to conservative management.",Duchesnay Inc.,Nausea and Vomiting of Pregnancy,8-Apr-13,4/8/13,Diclegis,doxylamine and pyridoxine,doxylamine,,,,,,,,,,
,Prolensa,NA,NA,NA,NA,NA,NA,NA,NA,NA,NA,NA,NA,TRUE,NA,"Prolensa (bromfenac ophthalmic solution) isa topical nonsteroidal anti-inflammatory indicated for the treatment of postoperative inflammation and reduction of ocular pain in patients who have undergone cataract surgery.",Bausch + Lomb,Postoperative Ocular Inflammation,5-Apr-13,4/5/13,Prolensa,bromfenac ophthalmic solution,bromfenac,,,,,,,,,,
,Invokana,TRUE,FALSE,FALSE,FALSE,FALSE,FALSE,FALSE,FALSE,FALSE,FALSE,FALSE,FALSE,FALSE,FALSE,Invokana (canagliflozin) is a selective sodium glucose co-transporter 2 (SGLT2) inhibitor indicated:,"Janssen Research & Development, LLC","Diabetes Type 2, Cardiovascular Risk Reduction, Diabetic Nephropathy",29-Mar-13,3/29/13,Invokana,canagliflozin,canagliflozin,,,,,,,,,,
,Quartette,NA,NA,NA,NA,TRUE,NA,NA,NA,NA,NA,NA,NA,NA,NA,Quartette (levonorgestrel/ethinyl estradiol and ethinyl estradiol) is a 91-day extended regimen oral contraceptive indicated for the prevention of pregnancy.,"Teva Branded Pharmaceutical Products R&D, Inc.",Contraception,28-Mar-13,3/28/13,Quartette,levonorgestrel/ethinyl estradiol and ethinyl estradiol,levonorgestrel,,,,,,,,,,
,Karbinal ER,NA,NA,NA,NA,NA,NA,NA,NA,NA,NA,NA,TRUE,NA,NA,Karbinal ER (carbinoxamine maleate) extended-release oral suspension is an H1 receptor antagonist indicated for the symptomatic treatment of seasonal and perennial allergic rhinitis.,"Tris Pharma, Inc.","Allergic Conjunctivitis, Allergic Reaction, Allergic Rhinitis, Allergic Urticaria",28-Mar-13,3/28/13,Karbinal ER,carbinoxamine maleate,carbinoxamine,,,,,,,,,,
,Tecfidera,NA,NA,NA,NA,NA,NA,NA,TRUE,NA,NA,NA,NA,NA,NA,Tecfidera (dimethyl fumarate) is an oral Nrf2 pathway activator for the treatment of relapsing forms of multiple sclerosis.,Biogen Idec,Multiple Sclerosis,27-Mar-13,3/27/13,Tecfidera,dimethyl fumarate,dimethyl,,,,,,,,,,
,TOBI Podhaler,NA,NA,NA,NA,NA,NA,TRUE,NA,NA,NA,NA,NA,TRUE,NA,"TOBI Podhaler (tobramycin  inhalation powder) is an antibacterial aminoglycoside indicated for the management of cystic fibrosis patients with Pseudomonas aeruginosa.",Novartis Pharmaceuticals Corporation,Cystic Fibrosis,22-Mar-13,3/22/13,TOBI Podhaler,tobramycin  inhalation powder,tobramycin,,,,,,,,,,
,Dotarem,NA,NA,NA,NA,NA,NA,NA,NA,NA,NA,NA,NA,NA,NA,Dotarem (gadoterate meglumine) is a gadolinium-based contrast agent indicated for use in magnetic resonance imaging (MRI).,Guerbet,Diagnostic,20-Mar-13,3/20/13,Dotarem,gadoterate meglumine,gadoterate,,,,,,,,,,
,Lymphoseek,NA,NA,NA,NA,NA,NA,NA,NA,NA,NA,NA,NA,NA,NA,"Lymphoseek (technetium Tc 99m tilmanocept) Injection is a radioactivediagnostic agent indicated for lymphatic mapping in patients with breast cancer or melanoma, and for guiding sentinel lymph nodebiopsy in patients with squamous cellcarcinoma of the oral cavity.",Navidea Biopharmaceuticals,Diagnostic,13-Mar-13,3/13/13,Lymphoseek,technetium Tc 99m tilmanocept,technetium,,,,,,,,,,
,Abilify Maintena,FALSE,FALSE,FALSE,FALSE,FALSE,FALSE,FALSE,FALSE,FALSE,TRUE,FALSE,FALSE,FALSE,FALSE,"Abilify Maintena (aripiprazole) is an atypical antipsychotic indicated for the treatment of schizophrenia, and maintenance monotherapy treatment of bipolar I disorder.","Otsuka Pharmaceutical Co., Ltd. and H. Lundbeck A/S","Schizophrenia, Bipolar Disorder",28-Feb-13,2/28/13,Abilify Maintena,aripiprazole,aripiprazole,,,,,,,,,,
,Osphena,FALSE,FALSE,FALSE,FALSE,TRUE,FALSE,FALSE,FALSE,FALSE,FALSE,FALSE,FALSE,FALSE,FALSE,"Osphena (ospemifene) is an estrogen agonist/antagonist indicated for the treatment of symptoms of vulvar and vaginal atrophy due to menopause, including severe dyspareunia and moderate to severe vaginal dryness.",Duchesnay Inc.,"Dyspareunia, Atrophic Vaginitis",26-Feb-13,2/26/13,Osphena,ospemifene,ospemifene,,,,,,,,,,
,Kadcyla,NA,NA,NA,NA,NA,NA,NA,NA,NA,NA,NA,NA,NA,NA,"Kadcyla (ado-trastuzumab emtansine) is a HER2-targeted antibody and microtubule inhibitor conjugate indicated for the treatment of patients with HER2-positive, metastatic breast cancer.","Genentech, Inc.",Breast Cancer,22-Feb-13,2/22/13,Kadcyla,ado-trastuzumab emtansine,ado,,,,,,,,,,
,Vituz,NA,NA,NA,NA,NA,NA,NA,NA,NA,NA,NA,NA,NA,NA,Vituz (chlorpheniramine and hydrocodone) Oral Solution is an antihistamine/antitussive combination indicated for the relief of cough and symptoms associated with upper respiratory allergies or a common cold.,"Hawthorn Pharmaceuticals, Inc.","Cough, Cold Symptoms",20-Feb-13,2/20/13,Vituz,chlorpheniramine and hydrocodone,chlorpheniramine,,,,,,,,,,
,Pomalyst,FALSE,FALSE,FALSE,FALSE,FALSE,FALSE,FALSE,TRUE,FALSE,FALSE,FALSE,FALSE,FALSE,FALSE,Pomalyst (pomalidomide) is a thalidomide analogue indicated for the treatment of patients with multiple myeloma.,Celgene Corporation,Multiple Myeloma,8-Feb-13,2/8/13,Pomalyst,pomalidomide,pomalidomide,,,,,,,,,,
,Ravicti,TRUE,FALSE,FALSE,FALSE,FALSE,FALSE,FALSE,FALSE,FALSE,FALSE,FALSE,FALSE,FALSE,FALSE,Ravicti (glycerol phenylbutyrate) is a nitrogen-binding agent for the chronic management of patients with urea cycle disorders.,Hyperion Therapeutics,Urea Cycle Disorders,1-Feb-13,2/1/13,Ravicti,glycerol phenylbutyrate,glycerol,,,,,,,,,,
,Delzicol,NA,NA,NA,NA,NA,NA,NA,NA,NA,NA,NA,NA,NA,NA,Delzicol (mesalamine) is an aminosalicylate indicated for the treatment of mildly to moderately active ulcerative colitis and for the maintenance of remission of ulcerative colitis. ,"Allergan, Inc.",Ulcerative Colitis,1-Feb-13,2/1/13,Delzicol,mesalamine,mesalamine,,,,,,,,,,
,Kynamro,FALSE,FALSE,TRUE,FALSE,FALSE,FALSE,FALSE,FALSE,FALSE,FALSE,FALSE,FALSE,FALSE,FALSE,Kynamro (mipomersen) is an oligonucleotide inhibitor of apolipoprotein B-100 synthesis indicated for the treatment of patients with homozygous familial hypercholesterolemia.,Kastle Therapeutics,Homozygous Familial Hypercholesterolemia,29-Jan-13,1/29/13,Kynamro,mipomersen,mipomersen,,,,,,,,,,
,Oxytrol for Women,FALSE,FALSE,FALSE,FALSE,TRUE,FALSE,FALSE,FALSE,FALSE,FALSE,FALSE,FALSE,FALSE,FALSE,Oxytrol for Women (oxybutynin) is a muscarinic receptor antagonist transdermal patch available over-the-counter for the treatment of overactive bladder in women. ,Merck,Overactive Bladder,25-Jan-13,1/25/13,Oxytrol for Women,oxybutynin,oxybutynin,,,,,,,,,,
,Nesina,TRUE,FALSE,FALSE,FALSE,FALSE,FALSE,FALSE,FALSE,FALSE,FALSE,FALSE,FALSE,FALSE,FALSE,Nesina (alogliptin) is a dipeptidyl peptidase-4 (DPP-4) inhibitor for the treatment of type 2 diabetes.,Takeda Pharmaceutical Company Limited ,Diabetes Type 2,25-Jan-13,1/25/13,Nesina,alogliptin,alogliptin,,,,,,,,,,
,Oseni,TRUE,NA,NA,NA,NA,NA,NA,NA,NA,NA,NA,NA,NA,NA,Oseni (alogliptin and pioglitazone) is a dipeptidyl peptidase-4 (DPP-4) inhibitor and thiazolidinedione fixed-dose combination for the treatment of type 2 diabetes.,Takeda Pharmaceutical Company Limited,Diabetes Type 2,25-Jan-13,1/25/13,Oseni,alogliptin and pioglitazone,alogliptin,,,,,,,,,,
,Kazano,TRUE,NA,NA,NA,NA,NA,NA,NA,NA,NA,NA,NA,NA,NA,Kazano (alogliptin and metformin) is a dipeptidyl peptidase-4 (DPP-4) inhibitor and biguanide antihyperglycemic fixed-dose combination for the treatment of type 2 diabetes.,Takeda Pharmaceutical Company Limited,Diabetes Type 2,25-Jan-13,1/25/13,Kazano,alogliptin and metformin,alogliptin,,,,,,,,,,
,Octaplas,NA,NA,NA,NA,NA,NA,NA,NA,NA,NA,NA,NA,NA,NA,"Octaplas is a solvent/detergent (S/D) treated, pooled human plasma indicated for the replacement of multiple coagulation factors in patients with acquireddeficiencies and plasma exchange in patients with thrombotic thrombocytopenic purpura.",Octapharma,Bleeding,17-Jan-13,1/17/13,Octaplas,S/D,S,,,,,,,,,,
,Zecuity,NA,NA,NA,NA,NA,NA,NA,NA,NA,TRUE,NA,NA,NA,NA,Zecuity (sumatriptan iontophoretic transdermal system) is a serotonin (5HT) 1b/1d receptor agonist (triptan) indicated for the acute treatment of migraine.,NuPathe Inc.,Migraine,17-Jan-13,1/17/13,Zecuity,sumatriptan iontophoretic transdermal system,sumatriptan,,,,,,,,,,
,Flublok,NA,NA,NA,NA,NA,NA,NA,NA,NA,NA,NA,NA,NA,NA,"FluBlok (influenza vaccine, recombinant hemagglutinin) is an influenza vaccine indicated for active immunization against seasonal influenza in adults 18 years of age and older .",Protein Sciences Corp.,Influenza Prophylaxis,16-Jan-13,1/16/13,Flublok,"influenza vaccine, recombinant hemagglutinin",influenza,,,,,,,,,,
,Uceris,TRUE,FALSE,FALSE,TRUE,FALSE,FALSE,FALSE,FALSE,FALSE,FALSE,FALSE,TRUE,FALSE,FALSE,"Uceris (budesonide) is a glucocorticosteroid indicated for the induction of remission in patients with active, mild to moderate ulcerative colitis. ","Santarus, Inc.",Ulcerative Colitis,14-Jan-13,1/14/13,Uceris,budesonide,budesonide,,,,,,,,,,
,Skyla,FALSE,FALSE,FALSE,FALSE,TRUE,FALSE,FALSE,FALSE,FALSE,FALSE,FALSE,FALSE,FALSE,FALSE,Skyla (levonorgestrel) is a progestin-containing intrauterine system (IUS) indicated for prevention of pregnancy for up to three years. ,Bayer HealthCare Pharmaceuticals Inc.,Contraception,9-Jan-13,1/9/13,Skyla,levonorgestrel,levonorgestrel,,,,,,,,,,
,Mytesi,TRUE,FALSE,FALSE,FALSE,FALSE,FALSE,FALSE,FALSE,FALSE,FALSE,FALSE,FALSE,FALSE,FALSE,Mytesi (crofelemer) is a proanthocyanidin oligomer indicated to relieve symptoms of diarrhea in HIV/AIDS patients taking antiretroviral therapy.,"Napo Pharmaceuticals, Inc.",Diarrhea,31-Dec-12,12/31/12,Mytesi,crofelemer,crofelemer,,,,,,,,,,
,Sirturo,FALSE,FALSE,FALSE,FALSE,FALSE,FALSE,TRUE,FALSE,FALSE,FALSE,FALSE,FALSE,FALSE,FALSE,Sirturo (bedaquiline) is an oral diarylquinoline antimycobacterial drug indicated for the treatment of pulmonary multi-drug resistant tuberculosis.,"Janssen Research & Development, LLC",Tuberculosis -- Resistant,28-Dec-12,12/28/12,Sirturo,bedaquiline,bedaquiline,,,,,,,,,,
,Bivigam,NA,NA,NA,NA,NA,NA,NA,NA,NA,NA,NA,NA,NA,NA,Bivigam is an immune globulin intravenous (human) indicated for the treatment of primary humoral immunodeficiency.,"Alexza Pharmaceuticals, Inc.","Agitation, Schizophrenia, Bipolar Disorder",21-Dec-12,12/21/12,Bivigam,human,human,,,,,,,,,,
,Gattex,TRUE,FALSE,FALSE,FALSE,FALSE,FALSE,FALSE,FALSE,FALSE,FALSE,FALSE,FALSE,FALSE,FALSE,Gattex (teduglutide) is a recombinant analog of human glucagon-like peptide 2 for the treatment of short bowel syndrome in adults and pediatric patients one year of age and older.,Biotest Pharmaceuticals Corporation,Primary Immunodeficiency Syndrome,21-Dec-12,12/21/12,Gattex,teduglutide,teduglutide,,,,,,,,,,
,VariZIG,NA,NA,NA,NA,NA,NA,NA,NA,NA,NA,NA,NA,NA,NA,VariZIG is a varicella zoster immune globulin (human) intended to reduce the severity of chickenpox (varicella) infections in high risk individuals.,"NPS Pharmaceuticals, Inc.",Short Bowel Syndrome,21-Dec-12,12/21/12,VariZIG,human,human,,,,,,,,,,
,Eliquis,FALSE,TRUE,FALSE,FALSE,FALSE,FALSE,FALSE,FALSE,FALSE,FALSE,FALSE,FALSE,FALSE,FALSE,"Eliquis (apixaban) is a factor Xa inhibitor anticoagulant indicated to reduce the risk of stroke and systemic embolism in patients with nonvalvular atrial fibrillation, and for the prophylaxis of deep vein thrombosis (DVT) in patients who have undergone hip or knee replacement surgery. ",Aegerion Pharmaceuticals Inc.,Homozygous Familial Hypercholesterolemia,21-Dec-12,12/21/12,Eliquis,apixaban,apixaban,,,,,,,,,,
,Juxtapid,FALSE,FALSE,TRUE,FALSE,FALSE,FALSE,FALSE,FALSE,FALSE,FALSE,FALSE,FALSE,FALSE,FALSE,Juxtapid (lomitapide) is a microsomal triglyceride transfer protein inhibitor indicated for the treatment of patients with homozygous familial hypercholesterolemia.,Cangene Corporation,Varicella-Zoster,20-Dec-12,12/20/12,Juxtapid,lomitapide,lomitapide,,,,,,,,,,
,Iclusig,FALSE,FALSE,FALSE,FALSE,FALSE,FALSE,FALSE,TRUE,FALSE,FALSE,FALSE,FALSE,FALSE,FALSE,Iclusig (ponatinib) is a kinase inhibitor  for the treatment of chronic myeloid leukemia (CML) and Philadelphia-chromosome positive acute lymphoblastic leukemia (Ph+ ALL).,"Ariad Pharmaceuticals, Inc.","Chronic Myelogenous Leukemia, Acute Lymphoblastic Leukemia",14-Dec-12,12/14/12,Iclusig,ponatinib,ponatinib,,,,,,,,,,
,Signifor,FALSE,FALSE,FALSE,FALSE,FALSE,TRUE,FALSE,FALSE,FALSE,FALSE,FALSE,FALSE,FALSE,FALSE,Signifor (pasireotide) is a multireceptor targeting somatostatin analog for the treatment of patients with Cushing's disease.,GlaxoSmithKline,Inhalation Bacillus anthracis,14-Dec-12,12/14/12,Signifor,pasireotide,pasireotide,,,,,,,,,,
,Adasuve,FALSE,FALSE,FALSE,FALSE,FALSE,FALSE,FALSE,FALSE,FALSE,TRUE,FALSE,FALSE,FALSE,FALSE,Adasuve (loxapine) is a typical antipsychotic indicated for the acute treatment of agitation associated with schizophrenia or bipolar I disorder in adults.,Novartis Pharmaceuticals Corporation,Cushing's Syndrome,14-Dec-12,12/14/12,Adasuve,loxapine,loxapine,,,,,,,,,,
,Evarrest,NA,NA,NA,NA,NA,NA,NA,NA,NA,NA,NA,NA,NA,NA,Evarrest (fibrin sealant patch) is indicated for use with manual compression as an adjunct to hemostasis for problematic soft tissue bleeding during surgery.,"Ethicon, Inc.",Bleeding,5-Dec-12,12/5/12,Evarrest,fibrin sealant patch,fibrin,,,,,,,,,,
,Cometriq,FALSE,FALSE,FALSE,FALSE,FALSE,FALSE,FALSE,TRUE,FALSE,FALSE,FALSE,FALSE,FALSE,FALSE,"Cometriq (cabozantinib) is a kinase inhibitor indicated for the treatment of patients with progressive, metastatic medullary thyroid cancer.","Exelixis, Inc.",Thyroid Cancer,29-Nov-12,11/29/12,Cometriq,cabozantinib,cabozantinib,,,,,,,,,,
,Flucelvax,NA,NA,NA,NA,NA,NA,NA,NA,NA,NA,NA,NA,NA,NA,Flucelvax (influenza virus vaccine) is an inactivated vaccine indicated for active immunization for the prevention of influenza.,Novartis,Influenza Prophylaxis,20-Nov-12,11/20/12,Flucelvax,influenza virus vaccine,influenza,,,,,,,,,,
,Xeljanz,FALSE,FALSE,FALSE,FALSE,FALSE,FALSE,FALSE,TRUE,FALSE,FALSE,FALSE,FALSE,FALSE,FALSE,"Xeljanz (tofacitinib) is an oral Janus kinase (JAK) inhibitor for the treatment of adult patients with moderately to severely active rheumatoid arthritis, active psoriatic arthritis, and moderately to severely active ulcerative colitis.",Pfizer Inc.,"Rheumatoid Arthritis, Psoriatic Arthritis, Ulcerative Colitis",6-Nov-12,11/6/12,Xeljanz,tofacitinib,tofacitinib,,,,,,,,,,
,Synribo,NA,NA,NA,NA,NA,NA,NA,TRUE,NA,NA,NA,NA,NA,NA,Synribo (omacetaxine mepesuccinate) is a first-in-class small molecule drug for the treatment of adult patients with chronic or accelerated phase chronic myeloid leukemia.,Teva Pharmaceuticals,Chronic Myelogenous Leukemia,26-Oct-12,10/26/12,Synribo,omacetaxine mepesuccinate,omacetaxine,,,,,,,,,,
,Fycompa,FALSE,FALSE,FALSE,FALSE,FALSE,FALSE,FALSE,FALSE,FALSE,TRUE,FALSE,FALSE,FALSE,FALSE,"Fycompa (perampanel) is a non-competitive AMPA glutamate receptor antagonist indicated for the treatment of partial-onset seizures, and as adjunctive therapy in the treatment of primary generalized tonic-clonic (PGTC) seizures in patients with epilepsy.",Eisai Inc.,"Epilepsy, Seizures",22-Oct-12,10/22/12,Fycompa,perampanel,perampanel,,,,,,,,,,
,Jetrea,FALSE,FALSE,FALSE,FALSE,FALSE,FALSE,FALSE,FALSE,FALSE,FALSE,FALSE,FALSE,TRUE,FALSE,Jetrea (ocriplasmin) is a proteolytic enzyme indicated for the treatment of symptomatic vitreomacular adhesion.,ThromboGenics NV,Vitreomacular Adhesion,17-Oct-12,10/17/12,Jetrea,ocriplasmin,ocriplasmin,,,,,,,,,,
,Cystaran,NA,NA,NA,NA,NA,NA,NA,NA,NA,NA,NA,NA,NA,NA,Cystaran (cysteamine cysteamine ophthalmic solution) is a  cystine-depleting agent indicated for the treatment of corneal cystine crystal accumulation in patients with cystinosis. ,"Sigma-Tau Pharmaceuticals, Inc. ",Cystinosis,2-Oct-12,10/2/12,Cystaran,cysteamine cysteamine ophthalmic solution,cysteamine,,,,,,,,,,
,Stivarga,FALSE,FALSE,FALSE,FALSE,FALSE,FALSE,FALSE,TRUE,FALSE,FALSE,FALSE,FALSE,FALSE,FALSE,"Stivarga (regorafenib) is an oral multi-kinase inhibitor for the treatment ofpatients with metastatic colorectal cancer, gastrointestinal stromal tumors, and hepatocellular carcinoma.",Bayer HealthCare Pharmaceuticals Inc.,"Colorectal Cancer, Gastrointestinal Stromal Tumor, Hepatocellular Carcinoma",27-Sep-12,9/27/12,Stivarga,regorafenib,regorafenib,,,,,,,,,,
,Quillivant XR,FALSE,FALSE,FALSE,FALSE,FALSE,FALSE,FALSE,FALSE,FALSE,TRUE,FALSE,FALSE,FALSE,FALSE,Quillivant XR (methylphenidate) is a central nervous system (CNS) stimulant indicated for the treatment of Attention Deficit Hyperactivity Disorder (ADHD).,"NextWave Pharmaceuticals, Inc.",Attention Deficit Disorder,27-Sep-12,9/27/12,Quillivant XR,methylphenidate,methylphenidate,,,,,,,,,,
,Aubagio,FALSE,FALSE,FALSE,FALSE,FALSE,FALSE,FALSE,TRUE,FALSE,FALSE,FALSE,FALSE,FALSE,FALSE,Aubagio (teriflunomide) is an oral pyrimidine synthesis inhibitor indicated for the treatment of patients with relapsing forms of multiple sclerosis.,Sanofi,Multiple Sclerosis,12-Sep-12,9/12/12,Aubagio,teriflunomide,teriflunomide,,,,,,,,,,
,Bosulif,FALSE,FALSE,FALSE,FALSE,FALSE,FALSE,FALSE,TRUE,FALSE,FALSE,FALSE,FALSE,FALSE,FALSE,"Bosulif (bosutinib) is a kinase inhibitor indicated for the treatment of adult patients with chronic, accelerated, or blast phase Ph+ chronic myelogenous leukemia (CML). ",Pfizer Inc.,Chronic Myelogenous Leukemia,4-Sep-12,9/4/12,Bosulif,bosutinib,bosutinib,,,,,,,,,,
,Xtandi,FALSE,FALSE,FALSE,FALSE,FALSE,FALSE,FALSE,TRUE,FALSE,FALSE,FALSE,FALSE,FALSE,FALSE,"Xtandi (enzalutamide) is an androgen receptor inhibitor indicated for the treatment of patients with castration-resistant prostate cancer, and metastatic castration-sensitive prostate cancer.",Astellas Pharma Inc.,Prostate Cancer,31-Aug-12,8/31/12,Xtandi,enzalutamide,enzalutamide,,,,,,,,,,
,Linzess,TRUE,FALSE,FALSE,FALSE,FALSE,FALSE,FALSE,FALSE,FALSE,FALSE,FALSE,FALSE,FALSE,FALSE,Linzess (linaclotide) is a guanylate cyclase-C agonist indicated in adults for treatment of irritable bowel syndrome with constipation (IBS-C) and chronic idiopathic constipation (CIC).,"Allergan, Inc.","Irritable Bowel Syndrome, Constipation -- Chronic",30-Aug-12,8/30/12,Linzess,linaclotide,linaclotide,,,,,,,,,,
,Granix,NA,NA,NA,NA,NA,NA,NA,NA,NA,NA,NA,NA,NA,NA,Granix (tbo-filgrastim) is a leukocyte growth factor indicated for the reduction in the duration of severe neutropenia in patients with non-myeloid malignancies receiving myelosuppressive anti-cancer drugs.,Teva Pharmaceutical Industries Ltd.,Neutropenia Associated with Chemotherapy,29-Aug-12,8/29/12,Granix,tbo-filgrastim,tbo,,,,,,,,,,
,Stribild,NA,NA,NA,NA,NA,NA,NA,NA,NA,NA,NA,NA,NA,TRUE,"Stribild (cobicistat, elvitegravir, emtricitabine and tenofovir) is a complete once-daily single tablet regimen for HIV-1 infection for treatment-naÃ¯ve adults. ","Gilead Sciences, Inc.",HIV Infection,27-Aug-12,8/27/12,Stribild,"cobicistat, elvitegravir, emtricitabine and tenofovir",cobicistat,,,,,,,,,,
,Auvi-Q,TRUE,TRUE,TRUE,NA,NA,NA,NA,NA,NA,NA,NA,TRUE,TRUE,NA,Auvi-Q (epinephrine injection) is a voice-guided epinephrine auto-injector for the emergency treatment of life-threatening allergic reactions in people who are at risk for or have a history of anaphylaxis.,Sanofi,"Anaphylaxis, Allergic Reaction",10-Aug-12,8/10/12,Auvi-Q,epinephrine injection,epinephrine,,,,,,,,,,
,Marqibo,NA,NA,NA,NA,NA,NA,NA,TRUE,NA,NA,NA,NA,NA,NA,Marqibo (vincristine sulfate liposome injection) is a vinca alkaloid indicated for the treatment of adult patients with Philadelphia chromosome-negative (Ph-) acute lymphoblastic leukemia (ALL).,Talon Therapeutics Inc.,Acute Lymphoblastic Leukemia,9-Aug-12,8/9/12,Marqibo,vincristine sulfate liposome injection,vincristine,,,,,,,,,,
,Zaltrap,NA,NA,NA,NA,NA,NA,NA,NA,NA,NA,NA,NA,NA,NA,Zaltrap (ziv-aflibercept) is an angiogenesis inhibitor for the combination treatment of patients with metastatic colorectal cancer.,"Sanofi and Regeneron Pharmaceuticals, Inc.",Colorectal Cancer,3-Aug-12,8/3/12,Zaltrap,ziv-aflibercept,ziv,,,,,,,,,,
,Vascepa,NA,NA,NA,NA,NA,NA,NA,NA,NA,NA,NA,NA,NA,NA,"Vascepa (icosapent ethyl) is an ethyl ester of eicosapentaenoic acid (EPA) indicated as an adjunct to diet to reduce triglyceride levels in adult patients with severe hypertriglyceridemia, and as an adjunct to statin therapy to reduce the risk of of cardiovascular events.",Amarin Corporation plc,"Hypertriglyceridemia, Cardiovascular Risk Reduction",26-Jul-12,7/26/12,Vascepa,icosapent ethyl,icosapent,,,,,,,,,,
,Rayos,TRUE,FALSE,FALSE,FALSE,FALSE,TRUE,FALSE,FALSE,FALSE,FALSE,FALSE,FALSE,FALSE,FALSE,"Rayos (prednisone) is a delayed release corticosteroid indicated as an anti-inflammatory or immunosuppressive agent to treat a broadrange of diseases including rheumatoid arthritis, polymyalgiarheumatica, psoriatic arthritis, ankylosing spondylitis, asthma and chronic obstructive pulmonary disease (COPD).","Horizon Pharma, Inc.","Rheumatoid Arthritis, Polymyalgia Rheumatica, Psoriatic Arthritis, Ankylosing Spondylitis, Asthma, Chronic Obstructive Pulmonary Disease",26-Jul-12,7/26/12,Rayos,prednisone,prednisone,,,,,,,,,,
,Tudorza,NA,NA,NA,NA,NA,NA,NA,NA,NA,NA,NA,NA,NA,NA,"Tudorza Pressair (aclidinium bromide inhalation powder) is an anticholinergic indicated for the long-term maintenance treatment of bronchospasm associated with chronic obstructive pulmonary disease (COPD), including chronic bronchitis and emphysema. ","Allergan, Inc.",Chronic Obstructive Pulmonary Disease,23-Jul-12,7/23/12,Tudorza,aclidinium bromide inhalation powder,aclidinium,,,,,,,,,,
,Kyprolis,FALSE,FALSE,FALSE,FALSE,FALSE,FALSE,FALSE,TRUE,FALSE,FALSE,FALSE,FALSE,FALSE,FALSE,Kyprolis (carfilzomib) is a proteasome inhibitor indicated for the treatment of patients with multiple myeloma.,Amgen Inc.,Multiple Myeloma,20-Jul-12,7/20/12,Kyprolis,carfilzomib,carfilzomib,,,,,,,,,,
,Qsymia,TRUE,NA,NA,NA,NA,NA,NA,NA,NA,NA,NA,NA,NA,NA,"Qsymia (phentermine and topiramate) is a combination of phentermine, a sympathomimetic amine anorectic, and topiramate extended-release, an antiepileptic drug, indicated as an adjunct to a reduced-calorie diet and increased physical activity for chronic weight management in adults.","Vivus, Inc.",Obesity,17-Jul-12,7/17/12,Qsymia,phentermine and topiramate,phentermine,,,,,,,,,,
,Prepopik,NA,NA,NA,NA,NA,NA,NA,NA,NA,NA,NA,NA,NA,NA,"Prepopik (sodium picosulfate, magnesium oxide and citric acid) is a stimulant laxative and osmotic laxative combination indicated for cleansing of the colon as a preparation for colonoscopy in adults.",Ferring Pharmaceuticals,Bowel Preparation,16-Jul-12,7/16/12,Prepopik,"sodium picosulfate, magnesium oxide and citric acid",sodium,,,,,,,,,,
,Myrbetriq,FALSE,FALSE,FALSE,FALSE,TRUE,FALSE,FALSE,FALSE,FALSE,FALSE,FALSE,FALSE,FALSE,FALSE,"Myrbetriq (mirabegron) is a beta-3 adrenergic agonist indicated for the treatment of overactive bladder (OAB) with symptoms of urge urinary incontinence, urgency, and urinary frequency.",Astellas Pharma Inc.,Overactive Bladder,28-Jun-12,6/28/12,Myrbetriq,mirabegron,mirabegron,,,,,,,,,,
,Belviq,TRUE,FALSE,FALSE,FALSE,FALSE,FALSE,FALSE,FALSE,FALSE,FALSE,FALSE,FALSE,FALSE,FALSE,"Belviq (lorcaserin) is a serotonin 2C receptor agonist indicated for chronic weight management in adults who are obese, or overweight and who have at least one weight-related condition such as high blood pressure, type 2 diabetes, or high cholesterol.","Arena Pharmaceuticals, Inc.",Obesity,27-Jun-12,6/27/12,Belviq,lorcaserin,lorcaserin,,,,,,,,,,
,MenHibrix,NA,NA,NA,NA,NA,NA,NA,NA,NA,NA,NA,NA,NA,NA,MenHibrix (Hib-MenCY-TT) is a combination vaccine for the active immunization of infants and young children 6 weeks through 18 months of age for the prevention of invasive diseases caused by Neisseria meningitidis serogroups C and Y and Haemophilus influenzae type b (Hib).,GlaxoSmithKline,"Haemophilus influenzae Prophylaxis, Meningococcal Meningitis Prophylaxis",14-Jun-12,6/14/12,MenHibrix,Hib-MenCY-TT,Hib,,,,,,,,,,
,Perjeta,FALSE,FALSE,FALSE,FALSE,FALSE,FALSE,FALSE,TRUE,FALSE,FALSE,FALSE,FALSE,FALSE,FALSE,Perjeta (pertuzumab) is a humanized monoclonal antibody indicated for the treatment of HER2-positive breast cancer.,Genentech,Breast Cancer,8-Jun-12,6/8/12,Perjeta,pertuzumab,pertuzumab,,,,,,,,,,
