,Poteligeo,NA,NA,NA,NA,NA,NA,NA,TRUE,NA,NA,NA,NA,NA,NA,"Poteligeo (mogamulizumab-kpkc) is a humanized monoclonal antibody (mAb) directed against CC chemokine receptor 4 (CCR4) for the treatment of Mycosis Fungoides (MF) and SÃ©zary Syndrome (SS), the most common subtypes of cutaneous T-cell lymphoma (CTCL).","Kyowa Hakko Kirin Co., Ltd.",Mycosis Fungoides; SÃ©zary Syndrome,8-Aug-18,8/8/18,Poteligeo,mogamulizumab-kpkc,mogamulizumab,,,,,,,,,,
,Arakoda,NA,NA,NA,NA,NA,NA,NA,NA,NA,NA,NA,NA,NA,NA,Arakoda (tafenoquine) is an 8-aminoquinoline antimalarial drug indicated for the prophylaxis of malaria in patients aged 18 years and older.,60 Degrees Pharmaceuticals,Malaria Prophylaxis,8-Aug-18,8/8/18,Arakoda,tafenoquine,tafenoquine,,,,,,,,,,
,Jornay PM,NA,NA,NA,NA,NA,NA,NA,NA,NA,TRUE,NA,NA,NA,NA,Jornay PM (methylphenidate hydrochloride) is a once-daily formulation of the approved central nervous system (CNS) stimulant methylphenidate indicated for the treatment of Attention Deficit Hyperactivity Disorder (ADHD) in patients 6 years and older.,"Ironshore Pharmaceuticals & Development, Inc.",Attention Deficit Hyperactivity Disorder (ADHD),8-Aug-18,8/8/18,Jornay PM,methylphenidate hydrochloride,methylphenidate,,,,,,,,,,
,Mulpleta,FALSE,TRUE,FALSE,FALSE,FALSE,FALSE,FALSE,FALSE,FALSE,FALSE,FALSE,FALSE,FALSE,FALSE,"Mulpleta (lusutrombopag) is a once-daily, orally administered, thrombopoietin (TPO) receptor agonist for the treatment of thrombocytopenia in patients with chronic liver disease who are scheduled to undergo a medical or dental procedure.",Shionogi Inc.,Thrombocytopenia,31-Jul-18,7/31/18,Mulpleta,lusutrombopag,lusutrombopag,,,,,,,,,,
,Azedra,NA,NA,NA,NA,NA,NA,NA,NA,NA,NA,NA,NA,NA,NA,Azedra (iobenguane I 131) is a  radioactive therapeutic agent for the treatment of locally advanced or metastatic pheochromocytoma and paraganglioma.,Progenics Pharmaceuticals Inc.,Pheochromocytoma; Paraganglioma,30-Jul-18,7/30/18,Azedra,iobenguane I 131,iobenguane,,,,,,,,,,
,Perseris,FALSE,FALSE,FALSE,FALSE,FALSE,FALSE,FALSE,FALSE,FALSE,TRUE,FALSE,FALSE,FALSE,FALSE,"Perseris (risperidone) is a once-monthly, subcutaneous formulation of the approved atypical antipsychotic risperidone indicated for the treatment of schizophrenia in adults. ",Indivior PLC,Schizophrenia,27-Jul-18,7/27/18,Perseris,risperidone,risperidone,,,,,,,,,,
,Orilissa,NA,NA,NA,NA,NA,NA,NA,NA,NA,NA,NA,NA,NA,NA,Orilissa (elagolix) is an orally administered gonadotropin-releasing hormone (GnRH) antagonist for the management of moderate to severe pain associated with endometriosis.,"AbbVie, Inc.",Endometriosis,23-Jul-18,7/23/18,Orilissa,elagolix,elagolix,,,,,,,,,,
,Tibsovo,NA,NA,NA,NA,NA,NA,NA,NA,NA,NA,NA,NA,NA,NA,Tibsovo (ivosidenib) is an isocitrate dehydrogenase-1 (IDH1) inhibitor for the treatment of patients with acute myeloid leukemia who have an IDH1 mutation.,"Agios Pharmaceuticals, Inc.",Acute Myeloid Leukemia,20-Jul-18,7/20/18,Tibsovo,ivosidenib,ivosidenib,,,,,,,,,,
,Nivestym,NA,NA,NA,NA,NA,NA,NA,TRUE,NA,NA,NA,NA,NA,NA,"Nivestym (filgrastim-aafi) is a recombinant human granulocyte colony-stimulating factor biosimilar to Neupogen indicated for the treatment of neutropenia associated with chemotherapy and related conditions.",Pfizer Inc.,"Neutropenia Associated with Chemotherapy, Febrile Neutropenia",20-Jul-18,7/20/18,Nivestym,filgrastim-aafi,filgrastim,,,,,,,,,,
,Krintafel,NA,NA,NA,NA,NA,NA,NA,NA,NA,NA,NA,NA,NA,NA,Krintafel (tafenoquine) is an 8-aminoquinoline derivative antimalarial for the radical cure (prevention of relapse) of Plasmodium vivax malaria.,GlaxoSmithKline,Malaria,20-Jul-18,7/20/18,Krintafel,tafenoquine,tafenoquine,,,,,,,,,,
,Symtuza,NA,NA,NA,NA,NA,NA,TRUE,NA,NA,NA,NA,NA,NA,NA,"Symtuza (darunavir, cobicistat, emtricitabine and tenofovir alafenamide) is a once daily, single-tablet regimen for the treatment of human immunodeficiency virus type 1 (HIV-1) in treatment-naÃ¯ve and certain virologically suppressed adults.","Janssen Pharmaceuticals, Inc.",HIV Infection,17-Jul-18,7/17/18,Symtuza,"darunavir, cobicistat, emtricitabine and tenofovir alafenamide",darunavir,,,,,,,,,,
,TPOXX,NA,NA,NA,NA,NA,NA,NA,NA,NA,NA,NA,NA,NA,NA,TPOXX (tecovirimat) is an orthopoxvirus-specific antiviral indicated for the treatment of human smallpox disease.,"SIGA Technologies, Inc.",Smallpox,13-Jul-18,7/13/18,TPOXX,tecovirimat,tecovirimat,,,,,,,,,,
,Qbrexza,NA,NA,NA,NA,NA,NA,NA,NA,NA,NA,NA,NA,NA,NA,"Qbrexza (glycopyrronium) is a topical anticholinergic contained in a single-use, pre-moistened, medicated cloth for the treatment of primary axillary hyperhidrosis (excessive underarm sweating) in adults and children 9 years of age and older.","Dermira, Inc.",Hyperhidrosis,28-Jun-18,6/28/18,Qbrexza,glycopyrronium,glycopyrronium,,,,,,,,,,
,Braftovi,FALSE,FALSE,FALSE,FALSE,FALSE,FALSE,FALSE,TRUE,FALSE,FALSE,FALSE,FALSE,FALSE,FALSE,"Braftovi (encorafenib) is a kinase inhibitor indicated, in combination withbinimetinib, for the treatment of patients with unresectable or metastatic melanoma with a BRAF V600E or V600K mutation, as detected by an FDA-approved test.",Array BioPharma Inc.,Melanoma -- Metastatic,27-Jun-18,6/27/18,Braftovi,encorafenib,encorafenib,,,,,,,,,,
,Mektovi,FALSE,FALSE,FALSE,FALSE,FALSE,FALSE,FALSE,TRUE,FALSE,FALSE,FALSE,FALSE,FALSE,FALSE,"Mektovi (binimetinib)  is a kinase inhibitor indicated, in combination with encorafenib, for the treatment of patients with unresectable or metastatic melanoma with a BRAF V600E or V600K mutation, as detected by an FDA-approved test.",Array BioPharma Inc.,Melanoma -- Metastatic,27-Jun-18,6/27/18,Mektovi,binimetinib,binimetinib,,,,,,,,,,
,Epidiolex,FALSE,FALSE,FALSE,FALSE,FALSE,FALSE,FALSE,FALSE,FALSE,TRUE,FALSE,FALSE,FALSE,FALSE,"Epidiolex (cannabidiol) is a prescription pharmaceutical formulation of highly-purified, marijuana plant-derived cannabidiol (CBD) for the treatment of seizures associated with Lennox-Gastaut syndrome or Dravet syndrome in patients two years of age or older.",GW Pharmaceuticals plc,"Lennox-Gastaut Syndrome, Dravet Syndrome",25-Jun-18,6/25/18,Epidiolex,cannabidiol,cannabidiol,,,,,,,,,,
,Zemdri,NA,NA,NA,NA,NA,NA,NA,NA,NA,NA,NA,NA,NA,NA,"Zemdri (plazomicin) is an aminoglycoside antibacterial for the treatment of complicated urinary tract infections.","Achaogen, Inc.",Urinary Tract Infection,25-Jun-18,6/25/18,Zemdri,plazomicin,plazomicin,,,,,,,,,,
,Nocdurna,NA,NA,NA,NA,NA,TRUE,NA,NA,NA,NA,NA,NA,NA,NA,"Nocdurna (desmopressin acetate) is a vasopressin analog indicated for the treatment of nocturia due to nocturnal polyuria in adults.",Ferring Pharmaceuticals Inc.,Nocturia,21-Jun-18,6/21/18,Nocdurna,desmopressin acetate,desmopressin,,,,,,,,,,
,moxidectin,NA,NA,NA,NA,NA,NA,NA,NA,NA,NA,NA,NA,NA,NA,Moxidectin is a macrocyclic lactone anthelmintic medicine indicated for the treatment of river blindness (onchocerciasis) in patients aged 12 years and older.,Medicines Development for Global Health,Onchocerciasis,13-Jun-18,6/13/18,moxidectin,onchocerciasis,onchocerciasis,,,,,,,,,,
,Fulphila,NA,NA,NA,NA,NA,NA,NA,TRUE,NA,NA,NA,NA,NA,NA,Fulphila (pegfilgrastim-jmbd) is a leukocyte growth factor biosimilar to Neulasta (pegfilgrastim) indicated to reduce the incidence of febrile neutropenia in patients treated with chemotherapy.,Mylan N.V.,Neutropenia Associated with Chemotherapy,4-Jun-18,6/4/18,Fulphila,pegfilgrastim-jmbd,pegfilgrastim,,,,,,,,,,
,Consensi,NA,NA,TRUE,NA,NA,NA,NA,NA,NA,NA,NA,NA,NA,NA,Consensi (amlodipine and celecoxib) is a calcium channel blocker and nonsteroidal anti-inflammatory drug combination for the treatment of both hypertension and pain associated with osteoarthritis.,Kitov Pharma Ltd.,"Hypertension, Osteoarthritis",31-May-18,5/31/18,Consensi,amlodipine and celecoxib,amlodipine,,,,,,,,,,
,Olumiant,FALSE,FALSE,FALSE,FALSE,FALSE,FALSE,FALSE,TRUE,FALSE,FALSE,FALSE,FALSE,FALSE,FALSE,Olumiant (baricitinib) is a Janus kinase (JAK) inhibitor for the treatment of rheumatoid arthritis.,Eli Lilly and Company and Incyte Corporation ,Rheumatoid Arthritis,31-May-18,5/31/18,Olumiant,baricitinib,baricitinib,,,,,,,,,,
,Imvexxy,FALSE,FALSE,FALSE,FALSE,TRUE,FALSE,FALSE,FALSE,FALSE,FALSE,FALSE,FALSE,FALSE,FALSE,Imvexxy (estradiol) is a bio-identical 17Î_-estradiol vaginal insert for the treatment of dyspareunia (vaginal pain during sexual intercourse) due to menopause.,"TherapeuticsMD, Inc.",Dyspareunia,29-May-18,5/29/18,Imvexxy,estradiol,estradiol,,,,,,,,,,
,Palynziq,NA,NA,NA,NA,NA,NA,NA,NA,NA,NA,NA,NA,NA,NA,Palynziq (pegvaliase-pqpz) is a phenylalanine-metabolizing enzyme indicated to reduce blood phenylalanine concentrations in adult patients with phenylketonuria.,BioMarin Pharmaceutical Inc.,Phenylketonuria,24-May-18,5/24/18,Palynziq,pegvaliase-pqpz,pegvaliase,,,,,,,,,,
,Yonsa,NA,NA,NA,NA,NA,NA,NA,TRUE,NA,NA,NA,NA,NA,NA,Yonsa (abiraterone acetate) is an ultramicrosize formulation of the oral CYP17 inhibitor abiraterone acetate (approved as Zytiga) used in combination with methylprednisolone for the treatment of metastatic castration-resistant prostate cancer.,Sun Pharmaceutical Industries Ltd.,Prostate Cancer,22-May-18,5/22/18,Yonsa,abiraterone acetate,abiraterone,,,,,,,,,,
,Doptelet,FALSE,TRUE,FALSE,FALSE,FALSE,FALSE,FALSE,FALSE,FALSE,FALSE,FALSE,FALSE,FALSE,FALSE,"Doptelet (avatrombopag) is a second generation, orally administered thrombopoietin receptor agonist (TPO-RA) indicated for the treatment of:","Dova Pharmaceuticals, Inc.","Thrombocytopenia, Idiopathic (Immune) Thrombocytopenic Purpura",21-May-18,5/21/18,Doptelet,avatrombopag,avatrombopag,,,,,,,,,,
,Lokelma,NA,NA,NA,NA,NA,NA,NA,NA,NA,NA,NA,NA,NA,TRUE,Lokelma (sodium zirconium cyclosilicate) is a potassium binder indicated for the treatment of hyperkalemia in adults.,AstraZeneca,Hyperkalemia,18-May-18,5/18/18,Lokelma,sodium zirconium cyclosilicate,sodium,,,,,,,,,,
,Aimovig,NA,NA,NA,NA,NA,NA,NA,NA,NA,TRUE,NA,NA,NA,NA,"Aimovig (erenumab-aooe) is a calcitonin gene-related peptide (CGRP) receptor antagonist indicated for the preventive treatment of migraine.",Amgen Inc.,Migraine Prophylaxis,17-May-18,5/17/18,Aimovig,erenumab-aooe,erenumab,,,,,,,,,,
,Lucemyra,NA,NA,NA,NA,NA,NA,NA,NA,NA,TRUE,NA,NA,NA,NA,Lucemyra (lofexidine hydrochloride) is a selective alpha 2-adrenergic receptor agonist indicated for reducing the severity of withdrawal symptoms in patients experiencing opioid withdrawal.,US WorldMeds,Opiate Withdrawal,16-May-18,5/16/18,Lucemyra,lofexidine hydrochloride,lofexidine,,,,,,,,,,
,Retacrit,NA,NA,NA,NA,NA,NA,NA,NA,NA,NA,NA,NA,NA,NA,"Retacrit (epoetin alfa-epbx) is an erythropoiesis-stimulating agent (ESA) biosimilar to Epogen/Procrit (epoetin alfa) indicated for treatment of anemia caused by chronic kidney disease, chemotherapy, or use of zidovudine in patients with HIV infection. Retacrit is also approved for use before and after surgery to reduce the chance that red blood cell transfusions will be needed because of blood loss during surgery.",Hospira Inc.,Anemia,15-May-18,5/15/18,Retacrit,epoetin alfa-epbx,epoetin,,,,,,,,,,
,Plenvu,NA,NA,NA,NA,NA,NA,NA,NA,NA,NA,NA,NA,NA,NA,"Plenvu (polyethylene glycol 3350, sodium ascorbate, sodium sulfate, ascorbic acid, sodium chloride and potassium chloride) is a lower-volume, polyethylene glycol based osmotic laxative indicated for cleansing of the colon (bowel preparation) prior to colonoscopy.","Salix Pharmaceuticals, Inc.",Bowel Preparation,4-May-18,5/4/18,Plenvu,"polyethylene glycol 3350, sodium ascorbate, sodium sulfate, ascorbic acid, sodium chloride and potassium chloride",polyethylene,,,,,,,,,,
,Andexxa,NA,NA,NA,NA,NA,NA,NA,NA,NA,NA,NA,NA,NA,NA,"Andexxa (coagulation factor Xa (recombinant), inactivated-zhzo) is a recombinant modified human Factor Xa (FXa) protein indicated for patients treated with rivaroxaban and apixaban, when reversal of anticoagulation isneeded due to life-threatening or uncontrolled bleeding. ","Portola Pharmaceuticals, Inc.",Reversal of Anticoagulant Activity of Factor Xa Inhibitors,3-May-18,5/3/18,Andexxa,recombinant,recombinant,,,,,,,,,,
,Jynarque,FALSE,FALSE,TRUE,FALSE,FALSE,FALSE,FALSE,FALSE,FALSE,FALSE,FALSE,FALSE,FALSE,FALSE,Jynarque (tolvaptan) is a selective vasopressin V2-receptor antagonist indicated to slow kidney function decline in adults at risk of rapidly progressing autosomal dominant polycystic kidney disease (ADPKD).,"Otsuka Pharmaceutical Co., Ltd.",Adults at Risk of Rapidly Progressing Autosomal Dominant Polycystic Kidney Disease,23-Apr-18,4/23/18,Jynarque,tolvaptan,tolvaptan,,,,,,,,,,
,Akynzeo for Injection,NA,NA,NA,NA,NA,NA,NA,NA,NA,NA,NA,NA,NA,NA,"Akynzeo for Injection (fosnetupitant and palonosetron) is a substanceP/neurokinin-1 (NK-1) receptor antagonist and serotonin-3 (5-HT3) receptor antagonist combination indicated for use with dexamethasone for the prevention of chemotherapy-induced nausea and vomiting (CINV).",Helsinn,Nausea/Vomiting -- Chemotherapy Induced,19-Apr-18,4/19/18,Akynzeo for Injection,fosnetupitant and palonosetron,fosnetupitant,,,,,,,,,,
,Tavalisse,FALSE,TRUE,FALSE,FALSE,FALSE,FALSE,FALSE,FALSE,FALSE,FALSE,FALSE,FALSE,FALSE,FALSE,"Tavalisse (fostamatinib) is an oral spleen tyrosine kinase (SYK) inhibitor for the treatment of patients with chronic immune thrombocytopenia (ITP).","Rigel Pharmaceuticals, Inc.",Idiopathic (Immune) Thrombocytopenic Purpura,17-Apr-18,4/17/18,Tavalisse,fostamatinib,fostamatinib,,,,,,,,,,
,Crysvita,NA,NA,NA,NA,NA,NA,NA,NA,TRUE,NA,NA,NA,NA,NA,Crysvita (burosumab-twza) is a fibroblast growth factor 23 (FGF23) blocking antibody for the treatment of x-linked hypophosphatemia (XLH).,Ultragenyx Pharmaceutical Inc.,X-Linked Hypophosphatemia,17-Apr-18,4/17/18,Crysvita,burosumab-twza,burosumab,,,,,,,,,,
,Symfi,NA,NA,NA,NA,NA,NA,TRUE,NA,NA,NA,NA,NA,NA,NA,"Symfi (efavirenz, lamivudine and tenofovir disoproxil fumarate) is a three-drug combination of a non-nucleoside reverse transcriptase inhibitor (efavirenz), and two nucleo(t)side reverse transcriptase inhibitors (lamivudine and tenofovir disoproxil fumarate) indicated as a complete regimen for the treatment of human immunodeficiency virus type 1 (HIV-1) infection.",Mylan N.V.,HIV Infection,22-Mar-18,3/22/18,Symfi,"efavirenz, lamivudine and tenofovir disoproxil fumarate",efavirenz,,,,,,,,,,
,Ilumya,NA,NA,NA,NA,NA,NA,NA,TRUE,NA,NA,NA,NA,NA,NA,"Ilumya (tildrakizumab-asmn) is a humanized, anti-IL-23p19 monoclonal antibody for the treatment of moderate-to-severe plaque psoriasis.",Sun Pharmaceutical Industries Ltd.,Plaque Psoriasis,20-Mar-18,3/20/18,Ilumya,tildrakizumab-asmn,tildrakizumab,,,,,,,,,,
,Trogarzo,NA,NA,NA,NA,NA,NA,TRUE,NA,NA,NA,NA,NA,NA,NA,Trogarzo (ibalizumab-uiyk) is a CD4-directed post-attachment HIV-1 inhibitor for the treatment of multidrug resistant human immunodeficiency virus-1 (HIV-1) infection in heavily treatment-experienced adults.,TaiMed Biologics USA Corp.,HIV Infection,6-Mar-18,3/6/18,Trogarzo,ibalizumab-uiyk,ibalizumab,,,,,,,,,,
,ZTlido,NA,NA,TRUE,TRUE,NA,NA,NA,NA,NA,TRUE,NA,TRUE,TRUE,NA,ZTlido (lidocaine topical system 1.8%) is a transdermal anesthetic formulation for the treatment of pain associated with postherpetic neuralgia.,"Scilex Pharmaceuticals, Inc.",Postherpetic Neuralgia,28-Feb-18,2/28/18,ZTlido,lidocaine topical system 1.8%,lidocaine,,,,,,,,,,
,Cimduo,NA,NA,NA,NA,NA,NA,TRUE,NA,NA,NA,NA,NA,NA,NA,Cimduo (lamivudine and tenofovir disoproxil fumarate) is a combination of two nucleo(t)side reverse transcriptase inhibitors indicated in combination with other antiretroviral agents for the treatment of human immunodeficiency virus type 1 (HIV-1) infection.,Mylan N.V.,HIV Infection,28-Feb-18,2/28/18,Cimduo,lamivudine and tenofovir disoproxil fumarate,lamivudine,,,,,,,,,,
,Apadaz,NA,NA,NA,NA,NA,NA,NA,NA,NA,NA,NA,NA,NA,NA,"Apadaz (acetaminophen and benzhydrocodone hydrochloride) is an immediate release combination of acetaminophen and  benzhydrocodone, a prodrug of the opioid agonist hydrocodone, indicated for the short-term management of acute pain.","KemPharm, Inc.",Pain,23-Feb-18,2/23/18,Apadaz,acetaminophen and benzhydrocodone hydrochloride,acetaminophen,,,,,,,,,,
,Iprivask,FALSE,TRUE,FALSE,FALSE,FALSE,FALSE,FALSE,FALSE,FALSE,FALSE,FALSE,FALSE,FALSE,FALSE,"Iprivask (desirudin) is a specific inhibitor of human thrombin indicated for the prophylaxis of deep vein thrombosis, which may lead to pulmonaryembolism, in patients undergoing elective hip replacement surgery.","Aventis Pharmaceuticals, Inc",Deep Vein Thrombosis -- Prophylaxis,4-Apr-03,4/4/03,,desirudin,desirudin,,,,,,,,,,
,Factive,FALSE,FALSE,FALSE,FALSE,FALSE,FALSE,TRUE,FALSE,FALSE,FALSE,FALSE,FALSE,FALSE,FALSE,"Factive (gemifloxacin) is a fluoroquinolone  antibiotics indicatedfor the treatment of community-acquired pneumonia and acutebacterial exacerbation of chronic bronchitis.","LG Life Sciences, Ltd",Bacterial Infection,4-Apr-03,4/4/03,,gemifloxacin,gemifloxacin,,,,,,,,,,
,Vigamox,FALSE,FALSE,FALSE,FALSE,FALSE,FALSE,TRUE,FALSE,FALSE,FALSE,FALSE,FALSE,TRUE,FALSE,"Vigamox (moxifloxacin) is a fourth generation fluoroquinilone antibiotic indicated for the treatment of bacterial conjunctivitis caused by susceptiblestrains of bacteria.",Alcon,Bacterial Conjunctivitis,15-Apr-03,4/15/03,,moxifloxacin,moxifloxacin,,,,,,,,,,
,Fabrazyme,TRUE,NA,NA,NA,NA,NA,NA,NA,NA,NA,NA,NA,NA,NA,"Fabrazyme (agalsidase beta) is a recombinant form of human alpha-galactosidase A,administered intravenously for the treatment of Fabry Disease.",Genzyme Corp,Fabry Disease,24-Apr-03,4/24/03,,agalsidase beta,agalsidase,,,,,,,,,,
,Aldurazyme,TRUE,FALSE,FALSE,FALSE,FALSE,FALSE,FALSE,FALSE,FALSE,FALSE,FALSE,FALSE,FALSE,FALSE,Aldurazyme (laronidase) is recombinant human alpha-L-iduronidaseis indicated for the treatment of mucopolysaccharidosis I (MPS I).,Biomarin Pharmaceutical,Mucopolysaccharidosis Type I,30-Apr-03,4/30/03,,laronidase,laronidase,,,,,,,,,,
,Vitrase,NA,NA,NA,NA,NA,NA,NA,NA,NA,NA,NA,NA,NA,NA,"Vitrase is a preparation of purified ovine testicular hyaluronidase indicated as an adjuvant to increase the absorption anddispersion of other injected drugs; for hypodermoclysis; and as an adjunct in subcutaneous urography for improving resorption of radiopaque agents.","ISTA Pharmaceuticals, Inc.","Hypodermoclysis, Subcutaneous Urography",5-May-04,5/5/04,,NA,NA,,,,,,,,,,
,HalfLytely and Bisacodyl  Tablets,NA,NA,NA,NA,NA,NA,NA,NA,NA,NA,NA,NA,NA,NA,"HalfLytely and Bisacodyl Tablet Bowel Prep Kit is a combination of PEG-3350, an osmotic laxative and bisacodyl, a stimulant laxative, indicated for cleansing of the colon as a preparation for colonoscopy in adults.","Braintree Laboratories, Inc.",Bowel Preparation,10-May-04,5/10/04,,NA,NA,,,,,,,,,,
,LidoSite,NA,NA,TRUE,TRUE,NA,NA,NA,NA,NA,TRUE,NA,TRUE,TRUE,NA,"LidoSite (lidocaine and epinephrine) is an iontophoretic delivery system providing local analgesia prior to the administration of superficial dermatologicalprocedures.","Vyteris, Inc.",Local Anesthesia,10-May-04,5/10/04,,lidocaine and epinephrine,lidocaine,,,,,,,,,,
,Enjuvia,NA,NA,NA,NA,NA,NA,NA,NA,NA,NA,NA,NA,NA,NA,"Enjuvia (synthetic conjugated estrogens, B) is a synthetic conjugated estrogenproduct indicated for the treatment of menopausal vasomotor symptoms and for the treatment of vaginal dryness and atrophy.",Duramed Pharmaceuticals,"Postmenopausal Symptoms, Atrophic Vaginitis",10-May-04,5/10/04,,"synthetic conjugated estrogens, B",synthetic,,,,,,,,,,
,Tindamax,FALSE,FALSE,FALSE,FALSE,FALSE,FALSE,TRUE,FALSE,FALSE,FALSE,TRUE,FALSE,FALSE,FALSE,"Tindamax (tinidazole) is a synthetic nitroimidazole antiprotozoal agent for the treatment of trichomoniasis, giardiasis, amebiasis, and bacterial vaginosis in nonpregnant women.",Presutti Laboratories,"Trichomoniasis, Giardiasis, Bacterial Vaginosis",17-May-04,5/17/04,,tinidazole,tinidazole,,,,,,,,,,
,DepoDur,NA,NA,NA,NA,NA,NA,NA,NA,NA,TRUE,NA,NA,NA,NA,DepoDur (morphine sulfate extended-release liposome injection) is an opiate for the treatment of pain following major surgery.,SkyePharma PLC and Endo Pharmaceuticals,Pain,18-May-04,5/18/04,,morphine sulfate extended-release liposome injection,morphine,,,,,,,,,,
,Vidaza,FALSE,FALSE,FALSE,FALSE,FALSE,FALSE,FALSE,TRUE,FALSE,FALSE,FALSE,FALSE,FALSE,FALSE,Vidaza (azacitidine) is an antineoplastic agent for the treatment of patients with myelodysplastic syndromes.,Pharmion Corporation,Myelodysplastic Disease,19-May-04,5/19/04,,azacitidine,azacitidine,,,,,,,,,,
,Octagam,NA,NA,NA,NA,NA,NA,NA,NA,NA,NA,NA,NA,NA,NA,Octagam (immune globulin intravenous (human)) is a ready-to-use immunoglobulin intravenous (IGIV) product indicated for the treatment of primary immunodeficiency diseases.,Octapharma AG,Primary Immunodeficiency Syndrome,21-May-04,5/21/04,,human,human,,,,,,,,,,
,Xifaxan,TRUE,FALSE,FALSE,TRUE,FALSE,FALSE,FALSE,FALSE,FALSE,FALSE,FALSE,FALSE,FALSE,FALSE,"Xifaxan (rifaximin) is a nonsystemic antibiotic indicated for the treatment of patients with traveler's diarrhea caused by noninvasive strains of Escherichia coli, to reduce the risk of recurrence of hepatic encephalopathy in patients with advanced liver disease, and for the treatment of irritable bowel syndrome with diarrhea (IBS-D).","Salix Pharmaceuticals, Ltd","Traveler's Diarrhea, Hepatic Encephalopathy, Irritable Bowel Syndrome",25-May-04,5/25/04,,rifaximin,rifaximin,,,,,,,,,,
,Sanctura,NA,NA,NA,NA,TRUE,NA,NA,NA,NA,NA,NA,NA,NA,NA,"Sanctura (trospium chloride) is an antispasmodic, antimuscarinic agent indicated for the treatment of overactive bladder with symptoms of urge urinary incontinence, urgency, and urinary frequency.","Allergan, Inc.","Overactive Bladder Syndrome, Urinary Frequency, Urinary Incontinence",28-May-04,5/28/04,,trospium chloride,trospium,,,,,,,,,,
,Revatio,FALSE,FALSE,FALSE,FALSE,TRUE,FALSE,FALSE,FALSE,FALSE,FALSE,FALSE,FALSE,FALSE,FALSE,Revatio (sildenafil) is a phosphodiesterase 5 (PDE5) inhibitor indicated for the treatment of pulmonary arterial hypertension.,Pfizer Inc.,Pulmonary Hypertension,3-Jun-05,6/3/05,,sildenafil,sildenafil,,,,,,,,,,
,Glumetza,TRUE,NA,NA,NA,NA,NA,NA,NA,NA,NA,NA,NA,NA,NA,Glumetza (metformin extended-release) is a once-daily oral antihyperglycemic formulation indicated for the treatment of type 2 diabetes.,"Biovail Corporation/Depomed, Inc.",Diabetes Type 2,3-Jun-05,6/3/05,,metformin extended-release,metformin,,,,,,,,,,
,Adacel,NA,NA,NA,NA,NA,NA,NA,NA,NA,NA,NA,NA,NA,NA,"Adacel (Tetanus Toxoid, Reduced Diphtheria Toxoid and Acellular Pertussis Vaccine Adsorbed (Tdap)) is indicated for active booster immunization for the prevention of tetanus, diphtheria and pertussis.",Aventis Pasteur Limited,"Tetanus Prophylaxis, Diphtheria Prophylaxis, Pertussis Prophylaxis",10-Jun-05,6/10/05,,Tdap,Tdap,,,,,,,,,,
,Tygacil,FALSE,FALSE,FALSE,FALSE,FALSE,FALSE,TRUE,FALSE,FALSE,FALSE,FALSE,FALSE,FALSE,FALSE,"Tygacil (tigecycline) is a glycylcycline antibacterial indicated for the treatment of complicated skin and skin structure infections, complicated intra-abdominal infections and community-acquired bacterial pneumonia in adults.",Wyeth Pharmaceuticals,"Skin and Structure Infection, Intraabdominal Infection, Pneumonia",15-Jun-05,6/15/05,,tigecycline,tigecycline,,,,,,,,,,
,Levemir,TRUE,NA,NA,NA,NA,NA,NA,NA,NA,NA,NA,NA,NA,NA,"Levemir (insulin detemir) is a novel, long- acting form of insulin that provides upto a 24-hour duration of action for the treatment of diabetesmellitus (type 1 and type 2).",Novo Nordisk Inc.,"Diabetes Type 1, Diabetes Type 2",16-Jun-05,6/16/05,,insulin detemir,insulin,,,,,,,,,,
,Aptivus,FALSE,FALSE,FALSE,FALSE,FALSE,FALSE,TRUE,FALSE,FALSE,FALSE,FALSE,FALSE,FALSE,FALSE,Aptivus (tipranavir) is a non-peptidic protease inhibitor which is co-administered with ritonavir for the treatment of HIV Infection.,Boehringer Ingelheim,HIV Infection,22-Jun-05,6/22/05,,tipranavir,tipranavir,,,,,,,,,,
,Synera,NA,NA,TRUE,TRUE,NA,NA,NA,NA,NA,TRUE,NA,TRUE,TRUE,NA,"Synera (lidocaine and tetracaine) is a local anesthetic patch indicated for use on intact skin to provide local dermalanalgesia before certain medical procedures","ZARS, Inc.",Local Anesthesia,23-Jun-05,6/23/05,,lidocaine and tetracaine,lidocaine,,,,,,,,,,
,BiDil,NA,NA,NA,NA,NA,NA,NA,NA,NA,NA,NA,NA,NA,NA,BiDil is a fixed-dose combination of isosorbide dinitrate (a vasodilator) and hydralazine hydrochloride (an arterial dilator) indicated for the treatment of heart failure in black patients.,"NitroMed, Inc.",Congestive Heart Failure,23-Jun-05,6/23/05,,a vasodilator,a,,,,,,,,,,
,Atripla,FALSE,FALSE,FALSE,FALSE,FALSE,FALSE,TRUE,FALSE,FALSE,FALSE,FALSE,FALSE,FALSE,FALSE,"Atripla is a once-daily single tablet regimen combining the non-nucleoside reverse transcriptase inhibitor Sustiva (efavirenz), and the nucleoside reverse transcriptase inhibitors Emtriva (emtricitabine) and Viread (tenofovir disoproxil fumarate). Atripla is indicated as a stand-alone therapy or in combination with other antiretrovirals for the treatment of HIV-1 infection in adults.","Bristol-Myers Squibb Company / Gilead Sciences, Inc.",HIV Infection,12-Jul-06,7/12/06,,efavirenz,efavirenz,,,,,,,,,,
,Implanon,FALSE,FALSE,FALSE,FALSE,TRUE,FALSE,FALSE,FALSE,FALSE,FALSE,FALSE,FALSE,FALSE,FALSE,"Implanon (etonogestrel) is a single-rod subdermal implant that continuallyreleases a low, steady dose of progestin  providing contraceptive effectiveness for a period of up to three years.",Organon,Contraception,18-Jul-06,7/18/06,,etonogestrel,etonogestrel,,,,,,,,,,
,Symbicort,TRUE,NA,NA,TRUE,NA,NA,NA,NA,NA,NA,NA,TRUE,NA,NA,"Symbicort (budesonide and formoterol) is a combination of a corticosteroid and a long-acting bronchodilator indicated for the long-termmaintenance treatment of asthma and the maintenance treatment of airflow obstruction in patients with chronic obstructive pulmonary disease (COPD), including chronic bronchitis and emphysema.",AstraZeneca,"Asthma -- Maintenance, Chronic Obstructive Pulmonary Disease -- Maintenance",21-Jul-06,7/21/06,,budesonide and formoterol,budesonide,,,,,,,,,,
